{
  "importer": "travel-planner",
  "erratum_id": "err_0001",
  "sequence": 1,
  "target_root": "mem_01HX",
  "operation": "supersede",
  "pre_state_root": "3854e8a2829938d5f9b63b1d581e5c6c3854e8a2829938d5f9b63b1d581e5c6c",
  "post_state_root": "0397835561846e8f0ac0c239710f752a0397835561846e8f0ac0c239710f752a",
  "stores": {
    "markdown": "verified",
    "vector": "verified",
    "prompt_cache": "unknown"
  },
  "dispositions": {
    "markdown": {
      "fact:diet": "retired",
      "summary:dining": "rebuilt"
    }
  },
  "triad": {
    "negative": "pass",
    "positive": "pass",
    "preserve": "pass"
  },
  "aggregate": "partial",
  "limitations": [
    "prompt_cache: store exposes no enumeration interface"
  ],
  "history_retained": true,
  "adapter_versions": {
    "markdown": "0.1.0"
  },
  "signature": "abababababababababababababababababababababababababababababababababababababababababababababababababababababababababababababababab"
}
